{
  "$schema": "https://json-schema.org/draft/2020-12/schema",
  "$id": "https://agent-orchestration.invalid/schemas/es-f1-a1-calibration-anchor-v1.json",
  "title": "ES F1 A1 calibration anchor",
  "type": "object",
  "additionalProperties": false,
  "required": [
    "schema_version",
    "preedit_policy_sha256",
    "evidence_root",
    "members",
    "selection",
    "metric",
    "record_sha256"
  ],
  "properties": {
    "schema_version": {"const": "es_f1_a1_calibration_anchor.v1"},
    "preedit_policy_sha256": {"$ref": "#/$defs/sha256"},
    "evidence_root": {
      "const": "/home/ollie/.local/share/agent-orchestration/lean-pilot-evidence/pilot-2026-07-27/a1-v7"
    },
    "members": {
      "type": "array",
      "minItems": 13,
      "maxItems": 13,
      "prefixItems": [
        {"$ref": "#/$defs/member_pilot_lock"},
        {"$ref": "#/$defs/member_summary"},
        {"$ref": "#/$defs/member_block_record"},
        {"$ref": "#/$defs/member_package_manifest"},
        {"$ref": "#/$defs/member_direct_patch"},
        {"$ref": "#/$defs/member_base_entrypoint"},
        {"$ref": "#/$defs/member_base_types"},
        {"$ref": "#/$defs/member_base_init"},
        {"$ref": "#/$defs/member_direct_entrypoint"},
        {"$ref": "#/$defs/member_direct_types"},
        {"$ref": "#/$defs/member_direct_init"},
        {"$ref": "#/$defs/member_review_1"},
        {"$ref": "#/$defs/member_review_2"}
      ],
      "items": false
    },
    "selection": {
      "type": "object",
      "additionalProperties": false,
      "required": [
        "pilot_lock_sha256",
        "block_id",
        "block_record_sha256",
        "arm_id",
        "treatment_id",
        "lifecycle_outcome",
        "viability_case",
        "comparison",
        "method_outcome",
        "product_quality_review_outcome",
        "product_manifest_sha256",
        "review_result_sha256"
      ],
      "properties": {
        "pilot_lock_sha256": {"const": "sha256:b8d69ba2f3d2b2e7bc6d9181d776db0b7abacd2035f851cd44be613dac6d8503"},
        "block_id": {"const": "b-5970f312e6698e50"},
        "block_record_sha256": {"const": "sha256:e5c3c5d8fca11860d48864cc1f4164d7b80df26cba62751754899f659b8f72c2"},
        "arm_id": {"const": "arm-4301192e76f41f90"},
        "treatment_id": {"const": "DIRECT"},
        "lifecycle_outcome": {"const": "COMPLETED"},
        "viability_case": {"const": "BOTH"},
        "comparison": {"const": "DIRECT_VS_ORC"},
        "method_outcome": {"const": "A_WIN"},
        "product_quality_review_outcome": {"const": "A"},
        "product_manifest_sha256": {"const": "sha256:1ec8f066bc042a582b20059aeb6f45f21ae5f799def730b3a6ca8792e97bde7a"},
        "review_result_sha256": {
          "const": [
            "sha256:881cf86d2fdcdef1a158fedceaf3211e82de0a3616c1f7080d48c5fe5443b2d9",
            "sha256:b10b517fdf63f330666fe96798733c3f1551987033fe9a86f2f43f5139cb07b4"
          ]
        }
      }
    },
    "metric": {
      "type": "object",
      "additionalProperties": false,
      "required": [
        "metric_version",
        "git_contract_policy_sha256",
        "base_member_ids",
        "candidate_member_ids",
        "patch_member_id",
        "implementation_additions",
        "implementation_deletions",
        "candidate_postimage_physical_lines"
      ],
      "properties": {
        "metric_version": {"const": "implementation_delta_physical_lines.v1"},
        "git_contract_policy_sha256": {"$ref": "#/$defs/sha256"},
        "base_member_ids": {
          "const": ["base_entrypoint", "base_types", "base_init"]
        },
        "candidate_member_ids": {
          "const": ["direct_entrypoint", "direct_types", "direct_init"]
        },
        "patch_member_id": {"const": "direct_patch"},
        "implementation_additions": {"const": 667},
        "implementation_deletions": {"const": 2},
        "candidate_postimage_physical_lines": {"const": 690}
      }
    },
    "record_sha256": {"$ref": "#/$defs/sha256"}
  },
  "$defs": {
    "sha256": {"type": "string", "pattern": "^sha256:[0-9a-f]{64}$"},
    "member_base": {
      "type": "object",
      "additionalProperties": false,
      "required": ["member_id", "path", "byte_count", "sha256"],
      "properties": {
        "member_id": {"type": "string", "minLength": 1},
        "path": {"type": "string", "minLength": 1},
        "byte_count": {"type": "integer", "minimum": 0},
        "sha256": {"$ref": "#/$defs/sha256"}
      }
    },
    "member_pilot_lock": {"allOf": [{"$ref": "#/$defs/member_base"}, {"properties": {"member_id": {"const": "pilot_lock"}, "path": {"const": "pilot-lock.json"}, "byte_count": {"const": 14598}, "sha256": {"const": "sha256:b8d69ba2f3d2b2e7bc6d9181d776db0b7abacd2035f851cd44be613dac6d8503"}}}]},
    "member_summary": {"allOf": [{"$ref": "#/$defs/member_base"}, {"properties": {"member_id": {"const": "summary"}, "path": {"const": "summary-2026-07-31/pilot-summary.json"}, "byte_count": {"const": 10901}, "sha256": {"const": "sha256:153263159d6516d032be83bd8f53954be0ba05b39af58be23d1abdca34085e89"}}}]},
    "member_block_record": {"allOf": [{"$ref": "#/$defs/member_base"}, {"properties": {"member_id": {"const": "block_record"}, "path": {"const": "evidence/b-5970f312e6698e50/block-attempt.json"}, "byte_count": {"const": 2576}, "sha256": {"const": "sha256:e5c3c5d8fca11860d48864cc1f4164d7b80df26cba62751754899f659b8f72c2"}}}]},
    "member_package_manifest": {"allOf": [{"$ref": "#/$defs/member_base"}, {"properties": {"member_id": {"const": "package_manifest"}, "path": {"const": "packages/b-5970f312e6698e50/b-5970f312e6698e50/manifest.json"}, "byte_count": {"const": 2987}, "sha256": {"const": "sha256:142320b4bf4f20e4015520583c535efcf22e8713552c152a25719c1473377cde"}}}]},
    "member_direct_patch": {"allOf": [{"$ref": "#/$defs/member_base"}, {"properties": {"member_id": {"const": "direct_patch"}, "path": {"const": "packages/b-5970f312e6698e50/b-5970f312e6698e50/candidates/candidate-3cca13b2595a/diff.patch"}, "byte_count": {"const": 33695}, "sha256": {"const": "sha256:55cd1a8216d0b7c749e6d9dfb47b1fa998ebed888101e5dca03349ba75d57ebb"}}}]},
    "member_base_entrypoint": {"allOf": [{"$ref": "#/$defs/member_base"}, {"properties": {"member_id": {"const": "base_entrypoint"}, "path": {"const": "evaluation/b-5970f312e6698e50/base/torch_port/entrypoint.py"}, "byte_count": {"const": 360}, "sha256": {"const": "sha256:c458f6b0fba0dc2ebd80c756d51278f53dc9d15320bf5f677c7878d8331aaa80"}}}]},
    "member_base_types": {"allOf": [{"$ref": "#/$defs/member_base"}, {"properties": {"member_id": {"const": "base_types"}, "path": {"const": "evaluation/b-5970f312e6698e50/base/torch_port/types.py"}, "byte_count": {"const": 85}, "sha256": {"const": "sha256:63118fc7530528b564f29752a20415b51db02fb572843d3864ba5e2f903eb92a"}}}]},
    "member_base_init": {"allOf": [{"$ref": "#/$defs/member_base"}, {"properties": {"member_id": {"const": "base_init"}, "path": {"const": "evaluation/b-5970f312e6698e50/base/torch_port/__init__.py"}, "byte_count": {"const": 113}, "sha256": {"const": "sha256:b33a873ed5bde35302e67190698bf0fa655bdd57077db89d5183101ef6f4ec35"}}}]},
    "member_direct_entrypoint": {"allOf": [{"$ref": "#/$defs/member_base"}, {"properties": {"member_id": {"const": "direct_entrypoint"}, "path": {"const": "evaluation/b-5970f312e6698e50/candidates/arm-4301192e76f41f90/torch_port/entrypoint.py"}, "byte_count": {"const": 26770}, "sha256": {"const": "sha256:f1ea1162fba1151aa8b13967565eaed9d515b0ebb8d35d0565a97c1fdaaa653c"}}}]},
    "member_direct_types": {"allOf": [{"$ref": "#/$defs/member_base"}, {"properties": {"member_id": {"const": "direct_types"}, "path": {"const": "evaluation/b-5970f312e6698e50/candidates/arm-4301192e76f41f90/torch_port/types.py"}, "byte_count": {"const": 85}, "sha256": {"const": "sha256:63118fc7530528b564f29752a20415b51db02fb572843d3864ba5e2f903eb92a"}}}]},
    "member_direct_init": {"allOf": [{"$ref": "#/$defs/member_base"}, {"properties": {"member_id": {"const": "direct_init"}, "path": {"const": "evaluation/b-5970f312e6698e50/candidates/arm-4301192e76f41f90/torch_port/__init__.py"}, "byte_count": {"const": 113}, "sha256": {"const": "sha256:b33a873ed5bde35302e67190698bf0fa655bdd57077db89d5183101ef6f4ec35"}}}]},
    "member_review_1": {"allOf": [{"$ref": "#/$defs/member_base"}, {"properties": {"member_id": {"const": "review_1"}, "path": {"const": "evidence/b-5970f312e6698e50/reviews/calibration-reviewer-01/review-result.json"}, "byte_count": {"const": 7998}, "sha256": {"const": "sha256:881cf86d2fdcdef1a158fedceaf3211e82de0a3616c1f7080d48c5fe5443b2d9"}}}]},
    "member_review_2": {"allOf": [{"$ref": "#/$defs/member_base"}, {"properties": {"member_id": {"const": "review_2"}, "path": {"const": "evidence/b-5970f312e6698e50/reviews/calibration-reviewer-02/review-result.json"}, "byte_count": {"const": 11577}, "sha256": {"const": "sha256:b10b517fdf63f330666fe96798733c3f1551987033fe9a86f2f43f5139cb07b4"}}}]}
  }
}
