{"evidence_root":"/home/ollie/.local/share/agent-orchestration/lean-pilot-evidence/pilot-2026-07-27/a1-v7","members":[{"byte_count":14598,"member_id":"pilot_lock","path":"pilot-lock.json","sha256":"sha256:b8d69ba2f3d2b2e7bc6d9181d776db0b7abacd2035f851cd44be613dac6d8503"},{"byte_count":10901,"member_id":"summary","path":"summary-2026-07-31/pilot-summary.json","sha256":"sha256:153263159d6516d032be83bd8f53954be0ba05b39af58be23d1abdca34085e89"},{"byte_count":2576,"member_id":"block_record","path":"evidence/b-5970f312e6698e50/block-attempt.json","sha256":"sha256:e5c3c5d8fca11860d48864cc1f4164d7b80df26cba62751754899f659b8f72c2"},{"byte_count":2987,"member_id":"package_manifest","path":"packages/b-5970f312e6698e50/b-5970f312e6698e50/manifest.json","sha256":"sha256:142320b4bf4f20e4015520583c535efcf22e8713552c152a25719c1473377cde"},{"byte_count":33695,"member_id":"direct_patch","path":"packages/b-5970f312e6698e50/b-5970f312e6698e50/candidates/candidate-3cca13b2595a/diff.patch","sha256":"sha256:55cd1a8216d0b7c749e6d9dfb47b1fa998ebed888101e5dca03349ba75d57ebb"},{"byte_count":360,"member_id":"base_entrypoint","path":"evaluation/b-5970f312e6698e50/base/torch_port/entrypoint.py","sha256":"sha256:c458f6b0fba0dc2ebd80c756d51278f53dc9d15320bf5f677c7878d8331aaa80"},{"byte_count":85,"member_id":"base_types","path":"evaluation/b-5970f312e6698e50/base/torch_port/types.py","sha256":"sha256:63118fc7530528b564f29752a20415b51db02fb572843d3864ba5e2f903eb92a"},{"byte_count":113,"member_id":"base_init","path":"evaluation/b-5970f312e6698e50/base/torch_port/__init__.py","sha256":"sha256:b33a873ed5bde35302e67190698bf0fa655bdd57077db89d5183101ef6f4ec35"},{"byte_count":26770,"member_id":"direct_entrypoint","path":"evaluation/b-5970f312e6698e50/candidates/arm-4301192e76f41f90/torch_port/entrypoint.py","sha256":"sha256:f1ea1162fba1151aa8b13967565eaed9d515b0ebb8d35d0565a97c1fdaaa653c"},{"byte_count":85,"member_id":"direct_types","path":"evaluation/b-5970f312e6698e50/candidates/arm-4301192e76f41f90/torch_port/types.py","sha256":"sha256:63118fc7530528b564f29752a20415b51db02fb572843d3864ba5e2f903eb92a"},{"byte_count":113,"member_id":"direct_init","path":"evaluation/b-5970f312e6698e50/candidates/arm-4301192e76f41f90/torch_port/__init__.py","sha256":"sha256:b33a873ed5bde35302e67190698bf0fa655bdd57077db89d5183101ef6f4ec35"},{"byte_count":7998,"member_id":"review_1","path":"evidence/b-5970f312e6698e50/reviews/calibration-reviewer-01/review-result.json","sha256":"sha256:881cf86d2fdcdef1a158fedceaf3211e82de0a3616c1f7080d48c5fe5443b2d9"},{"byte_count":11577,"member_id":"review_2","path":"evidence/b-5970f312e6698e50/reviews/calibration-reviewer-02/review-result.json","sha256":"sha256:b10b517fdf63f330666fe96798733c3f1551987033fe9a86f2f43f5139cb07b4"}],"metric":{"base_member_ids":["base_entrypoint","base_types","base_init"],"candidate_member_ids":["direct_entrypoint","direct_types","direct_init"],"candidate_postimage_physical_lines":690,"git_contract_policy_sha256":"sha256:58c757172ca0c7bb667f7b1291a09d9ec8e37866fe6cd04d903037a5a8bd5c85","implementation_additions":667,"implementation_deletions":2,"metric_version":"implementation_delta_physical_lines.v1","patch_member_id":"direct_patch"},"preedit_policy_sha256":"sha256:58c757172ca0c7bb667f7b1291a09d9ec8e37866fe6cd04d903037a5a8bd5c85","record_sha256":"sha256:9bdadcd01077cdd2ea892a773fa54f2b83ad64e29d913f7874809e862f81c477","schema_version":"es_f1_a1_calibration_anchor.v1","selection":{"arm_id":"arm-4301192e76f41f90","block_id":"b-5970f312e6698e50","block_record_sha256":"sha256:e5c3c5d8fca11860d48864cc1f4164d7b80df26cba62751754899f659b8f72c2","comparison":"DIRECT_VS_ORC","lifecycle_outcome":"COMPLETED","method_outcome":"A_WIN","pilot_lock_sha256":"sha256:b8d69ba2f3d2b2e7bc6d9181d776db0b7abacd2035f851cd44be613dac6d8503","product_manifest_sha256":"sha256:1ec8f066bc042a582b20059aeb6f45f21ae5f799def730b3a6ca8792e97bde7a","product_quality_review_outcome":"A","review_result_sha256":["sha256:881cf86d2fdcdef1a158fedceaf3211e82de0a3616c1f7080d48c5fe5443b2d9","sha256:b10b517fdf63f330666fe96798733c3f1551987033fe9a86f2f43f5139cb07b4"],"treatment_id":"DIRECT","viability_case":"BOTH"}}
